id_room,typeRoom,numberRoom,priceNight,offersRoom,statusRoom,cancellationRoom
119,[object Object],98660,$087.49,[object Object],Booked,Qviuzn Zoobuzva Xlisc Suztv Lllrqso Bbvnqc Lvdyqpd Qbiy Sdly xjt.
137,[object Object],16327,$121.17,[object Object],Booked,Xeuzzl Eawithq Zzqeond Bntf Gshjel Evdl Chjxmgxc dwaoze.
133,[object Object],20062,$125.27,[object Object],Booked,Ipxf Tkblutnf Rlwp Mhyrhlp Cvcc Qeybcwbr Akfsp Vpato Tupeur Pyzcrye etcbspe.
140,[object Object],67356,$127.49,[object Object],Available,Koegyml Dguk Cmvg Gbon Ujdbtdte wvl.
123,[object Object],29504,$127.55,[object Object],Available,Nneajt Xjhzqhe Ztfufy Qcxhjn Biqu Pjwxksc Jnbcsjvd Ixpwrb ygx.
130,[object Object],94966,$128.99,[object Object],Available,Hmrzlhk Vxgn Tcfvmc Lwfabpo Bidvbbq Iompu Yhyel Dstwqya tzksdpr.
103,[object Object],50312,$134.78,[object Object],Available,Ivyejq Kqnlvkdw Ybzkofhh Zuqfjvv Sfyt Yjubf Bsbb bbrje.
118,[object Object],35974,$146.73,[object Object],Available,Cmztsqi Nkigq Opjlapcf Clfafx Moekfhrs Djhrrj Jjwg wxq.
135,[object Object],58722,$147.37,[object Object],Available,Hwqat Nhcyqdir Xfho Pdei Tlvndnw Yszhkqld Upupoor Tpnexmr Ivwnoltd mfdxxm.
128,[object Object],54757,$154.19,[object Object],Booked,Itrhbb Vsjhj Jbdfsry Ueud Vidubnap Lxhgwu dvwc.
101,[object Object],73947,$163.87,[object Object],Available,Aabfokg Kazndvo Pfplndpn Euvlulh Wfhhvgh jwyrfe.
115,[object Object],85194,$173.31,[object Object],Booked,Jbev Koimoyr Hwuucbgd Byxwn Zvikahxq sghpxo.
129,[object Object],47581,$177.42,[object Object],Available,Msrgf Mqoic Qremdv Yykg Ghnwg Shmqrvaq Wthhzld Htwmlnuk Nabi Buae clhagw.
134,[object Object],48336,$179.75,[object Object],Booked,Ggwp Nbczjm Tlqihvaz Kdclbhar Wjkfsn Xndk Iiyz Dzfpncoq xeo.
124,[object Object],36119,$188.87,[object Object],Available,Cycky Qzwjud Inhsncr Prhijk Brean Crssrsw Kjiuz Qzurge ccbb.
121,[object Object],62809,$193.76,[object Object],Booked,Arbzqyyx Osjzpl Lqorezm Gbyape Jwxhk Rgmyulz Cqyswz Hdmuaofr pcp.
104,[object Object],85373,$195.10,[object Object],Booked,Qsiyc Cayej Sccie Uxsyb Llci Cvksgtzj iwlrcb.
106,[object Object],55413,$196.92,[object Object],Available,Kmqnd Ubtbk Mujxrgv Lkskc Vimble kdiomjm.
102,[object Object],15083,$199.22,[object Object],Booked,Zfsiwvt Qtshlaap Vxemg Ugti Nvqmww Pcoaykpq Pxpl Emtn Gfedp Ceoqkhr loegri.
125,[object Object],17545,$199.52,[object Object],Booked,Nkchsng Hdql Fqhwoi Ovrtz Oebs Iqnaxdw Ikkad Hxfbzxlr Sbgg Ushyekg boqtv.
105,[object Object],72169,$209.07,[object Object],Available,Dmalhu Tkoa Zyhd Jfhlcf Hnpfcmfo Pufb Wirbdloh Qattiwse xedny.
109,[object Object],03859,$216.83,[object Object],Booked,Cycxubgp Qhkhcb Aanqf Acmjebrr Ocwnldl Llyktt Afoyixwi Ajbkvgo Wynug krki.
139,[object Object],23690,$218.49,[object Object],Available,Dazhrlfj Srkibm Hegc Geabxg Ompydwo Fgnn Mpah Cjfxqu qtwcrkt.
131,[object Object],56684,$223.74,[object Object],Available,Fhtbhfqq Ukipwkc Rwoxinrd Afwepg Bjyefxc Rvmnmhx Kdeepmxu Lgxog Eterctpg dukspa.
126,[object Object],39157,$231.16,[object Object],Booked,Ifdpp Wtryeawc Nfizve Fxqhanq Jqrsa Qbjrjsio Bwuuoa Rvrz ljgnoz.
111,[object Object],03217,$245.00,[object Object],Available,Tndn Ghitnyz Mcrnipvf Wiaaqkhr Bymcqt Dbfwuc yttgr.
136,[object Object],59258,$245.22,[object Object],Booked,Bxdxhhe Dlnaig Xehuq Yttz Vjwtf Hgplmpg Hbzxeer Brkzglgh Xrlq Giwjdzw ypn.
110,[object Object],75001,$258.58,[object Object],Available,Rejxfjsi Mqldohq Xfvuxke Kfgig Vewi Slptfkmu Grntoo Dhsdm Maozm Qpcffneg lvbqhzw.
116,[object Object],85075,$260.64,[object Object],Available,Vebgyafq Mbps Uhsenmjo Xiprb Cdzpoo Kzlhbxj Hlaepoun Bklngkhw dppjhl.
127,[object Object],45822,$285.46,[object Object],Available,Tnqa Kkci Oricz Nqpabkw Jkqebr Hnmmlpa Ydudfxi Oxdvvm Bjvmwe hebbpe.
120,[object Object],58792,$293.20,[object Object],Booked,Osmgbksd Wsnpnqx Hvgrt Dvtcvf Oljknmt Pyxcge Pouenxk Jcjgphtt Cwgu Mnwoeeb vgz.
113,[object Object],94262,$307.59,[object Object],Available,Wrpwy Yfiezsbv Qridao Ikajqit Ecdbtpeo Mtkq Tkren Iywtj qncsa.
122,[object Object],50229,$318.85,[object Object],Available,Mhem Ysqxoh Jxunf Tuxviz Kkynkz kxqm.
108,[object Object],77517,$321.40,[object Object],Booked,Emsanvoh Ibxjey Quhxfv Bxvbx Iantis Hcos Ivlv Hnwswxfx Acdl urjxj.
114,[object Object],87514,$328.64,[object Object],Booked,Vznxvgl Myectg Zlcik Peegfex Clgu balb.
132,[object Object],44470,$330.07,[object Object],Booked,Ehis Mhwco Jeqfgo Boijdk Ckwav Kgpekj Cdkysk Umqsuvbc aznvk.
117,[object Object],39322,$331.94,[object Object],Booked,Rrigc Hjhtcjh Pktgiov Bsfdum Wkykppl Licqzedi Hhuk Fconpq Pnjrvlg pct.
112,[object Object],54746,$342.48,[object Object],Booked,Gxscmaf Ealdlvt Fwib Psib Broub Excmbbg Nqfurr Achqtn vldpwkl.
138,[object Object],68980,$344.12,[object Object],Booked,Impymcpr Flsoatid Oqsj Kbyiwbe Lkmqc Xzqhhw phnvcg.
107,[object Object],16364,$347.26,[object Object],Available,Vpotrl Mbabxtkp Ppaduoqa Nvurgqf Mtydp Soaaquwl kye.